1,Phone Quality,Price and Value,Phone Hardware,Phone Performance,Packaging and Delivery
گوشی خوبیه از هر نظر فقط وقی میزنم ب شارژ تاچ قاطی میکنه در حالت شارژ شدن نمیشه باهاش کار کرد نمیدونم برا بقیه ام همینه یا نه .کیفیت صفحه نمایش عالیه باطری ۱روز کامل و جواب میده اگه زیاد کار نکنی که ۲روز میشه من قبلا هوآوی داشتم ولی خدایی سامسونگ یه چیز دیگس دوربینش در حد خوبه ولی خیلی عالی نیست خوش دسه .,Yes,No,Yes,Yes,No
من حدود ۴ ماه استفاده میکنم خیلی هم عالیه یکی از بهترینهاست از هر لحاظ عالیه . باری آسفالت ۹ رو نصب کرده ام بدون لگ کار میکنه . دوربین هم خوبه و کیفیت خوبی داره و امکانات خوبی داره اگر از گوشی سر دربیارید .,Yes,No,Yes,Yes,No
درمقایسه با گوشی قبلم که ردمی نوت ۸ بود: این گوشی وزن بیشتری داره . دوربین ها ناامیدتون نمی‌کنند و میتونید با اطمینان باهاشون عکس بگیرید و حتی شاید تولید محتوا کنید .کار سنگین باهاش نکردم و تاحالا لگ و هنگی ازش ندیدم .در استفاده‌ی روزانه و حدود ۱۰ ساعت متوالی کارکردن باهاش باتری کم نمیاره و حدود یک روز یاری میکنه.درمقایسه با گوشی قبلم صفحه نمایش خیلی بهتر هست و راضی کننده اس .اندازه ی صفحه تز ردمی ۸ و ایفون ۱۳ بزرگتر است .,No,No,Yes,Yes,No
گوشی خوبیه و بدون هیچ مشکلی رجیستر شد و نسخه اندروید هم به سرعت بروز شد و ورژن ۱۴ رو دریافت کرد.فقط یه خورده وزنش زیاده که فکر نکنم زیاد مشکلی باشه.با تشکر از دیجیکالا,No,No,No,No,No
"گوشی قبلی من شیامی mi 9 lite بود و راضی بودم. ۲ روز قبل از عید a54 گرفتم ولی همون ساعت اول دلم را زد و گوشی NoteYes3pro 5g گرفتم. الان هم راضی هستم. سامسونگ قشنگ بود، صفحه شفافی داشت ولی روشناییش نسبت به NotYes3 pro کمتر بود، شبیه پرچمدار بود. نسبت به شیامی بیشتر داغ میکرد. داخل جعبه هم هیچی نداره ولی شیامی جدیدا گلس صفحه هم داره. با اینکه صفحه شیامی نسبت به سامسونگ بزرگتره ولی خوش‌دست تره به نظر من کسی که قبلا شیامی داشته بهتره که نره سراغ سامسونگ.",No,No,Yes,Yes,No
به نظرم خوب میاد هنوز ازش استفاده نکردم با توجه به نظر مشتری های دی جی خریدم,No,No,No,No,No
الان a35 اومده با همین مشخصات و تازه بهتره از این و یکسال جدید تر هم هست این با این قیمت ارزش خرید ندارد تو سامسونگ ها و در کل هم که الان با این قیمت میشه یه x6 pro خرید,No,Yes,Yes,No,No
موقعی که تو شارژ باهاش کار میکنی لمس گوشی به شدت ضعیف میشه باتری نسبت به هم قیمت‌هاش در برند شیائومی ضعیفه پیام بلند ارسال نمیشه هنگ میکنه و در حالت هنگ گوشی خاموش میشه,Yes,Yes,Yes,Yes,No
کلا دیجی کالا سر وقت سفارشات را میرساند من هر وسیله دیجیتالی که خریدم راضی بودم,No,No,No,No,Yes
"بسیار عالیه،از همه نظر خوبه،گوشی پلمپ بوده و ویتنام یک روزه به دستم رسید ممنون از دیجیکالا",No,No,No,No,Yes
پنج روزه گوشی سامسونگ a54 رو تحویل گرفتم رجیستر نمیشه متاسفانه دیجی کالا و گارانتی هم پاسخگو نیست.,No,No,No,No,Yes
"سالم و با بسته بندی مناسب، ولی بطور کلی خرید کالای الکترونیکی و دیجیتال از ریسک بالای برخوردار است.",No,No,No,No,Yes
بازار واقعا خرابه بجای اینکه a55 اومده ارزون تر بشه این گوشی داره گرونتر هم میشه اگه میخواین بخرین معطل نکنید اینجا ایرانه یهو پا میشی میبینی دلار شد ۷۰ ۸۰ تومن گوشیم رف فضا,No,Yes,No,No,No
"واقعا منطق دوستانی که اینقدر سنگ سامسونگ رو به سینه میزنن نمیفهمم ، الان این مدل نه رزولیشین در حد گوشی هفده تومنی داره نه مثل همه سامسونگ ها شارژر قوی ای داره و نه سی پی یوی آنچنان خوبی . ارزش خریدش بشدت پایینه . حالا برو با همین قیمت مشخصات گوشی ردمی نوت Yes3 پرو 5G رو ببین از همه نظر بهتر از اینه",No,Yes,Yes,Yes,No
"کارای خیلی خوب ، تاچ و صورت فوق‌العاده عالی و با این مبلغ حتی از s۲۳ هم بهتر هستش",No,Yes,No,Yes,No
"گوشی که مورد انتظار بود، خداروشکر؛ فقط امیدوارم شرکت گارانتی کننده کد فعالسازی رو روی کارتن محصول قرار بده که این کار رو سریع انجام بدیم... روز عید بود و تماس رو پاسخگو نبودند. سایت شون کد ورود نمیداد. بعد از یک روز تونستم فعالسازی کنم.",No,No,No,No,Yes
گوشی خوبیه در کل اما گله دارم از دیجیکالا که بسته منو ۷ روز بعد از انتخاب بازه زمانی ارسال کرد . هنگام تحویل هم پلمپ کارتن دیجیکالا اش باز شده بود ولی خود کارتن گوشی سالم بود.,No,No,No,No,Yes
"گوشی خوبیه ، فقط یه نصیحت به تمامی دوستانی که گوششی رو میخرن برای پشت گوشی گلس بچسبونن چون پشت گوشی شیشه ای هستش اگه کاورتون جنسش خوب نباشه نقطه نقطه سفید میشه پشتش.",No,No,No,No,No
بنظر شما الان A35 بخرم یا A54 وقتی هردو از نظر سخت افزار کاملا یکسان هستن,No,No,Yes,Yes,No
با سلام اصلا خوب نیست داغ میکنه باتری بی کیفیت,Yes,No,Yes,Yes,No
"سلام وقت بخیر

Galaxy S2Yes FE مشخصات بهتری داره، از نظر سخت‌افزار و دوربین عملکردش نسبتا بهتره.",No,No,Yes,Yes,No
برای من بعد از ۳ ماه شدیداااا داغ می‌کنه لعنتی... صورتم موقع صحبت می‌سوزه,Yes,No,Yes,Yes,No
عالیه فقط وقتی ۲ تا سیم کارت میندازی رم دیگه نمیخوره من از تهران حضوری خریدم,Yes,No,No,No,No
گوشی با شارژر امروز بدستم رسید ممنون از تکنولایف بخاطر اصل بودن کالا..عالی,Yes,No,No,No,Yes
"سلام وقت بخیراز نظر کیفیت دوربین، فست شارژ باتری و سخت‌افزار (با توجه حافظه رم بیشتر) Realme YesYes Pro Plus عملکرد بهتری داره.",Yes,No,Yes,Yes,No
سلام من اولین باره که از این سایت خرید کردم و خوشحالم که تجربه یه خرید عالی از هر نظر رو داشتم دوست دارم بقیه رو هم با این سایت آشنا کنم ممنونم از پشتیبانی عالی و حرفه ایتون,No,No,No,No,No
گوشی خیلی خوبیه من راضی ام بازی های سنگین مثل کال‌آف‌دیوتی رو هم بدون لگ جواب میده,No,No,Yes,Yes,No
واقعا عالی. هم به موقع به دستم رسید هم بسته بندی درجه Yes بود هم اینکه گوشی پلمپ بود. ممنونم از تیم خیلی خوب تکنو لایف,No,No,No,No,Yes
از نظر کیفیت گوشی خیالم راحته. بار ها شده که یک مدل گوشی را از فروشگاه بیرون خریدم و کیفیت مد نظرم را نداشته. ولی از تکنو لایف مطمین هستم.,Yes,No,No,No,No
کاش یه گوشی بهتری میخریدم نسبت به قیمت خوبه اما با توجه به اینکه کار من کلا با گوشیه کافی نیست برای کار کردن در تمام روز باتری خوب نگه میداره روشنایی صفحه خوبه کاش یه گوشی میخریدم که قلم داشته باشه,No,Yes,No,No,No
الان من یه هفته است خریدم چرا اصلا باتری نگه نمیداره هرروز میخوادشارژکنم وبه شدت باتری تموم میشه,No,No,Yes,No,No
خیلی ناراضیم آخرین بار بود کلا سامسونگ خریدم با پولی که برای این دادم میتونستم یه شیائومی خوب بگیرم,No,Yes,No,No,No
"با قیمت فعلی اصلا ارزش خرید نداره ،تو این بازه قیمتی s2Yes fe انتخاب خیلی بهتریه",No,Yes,No,No,No
حیف پول برای این گوشی میان رده در حد میان رده هم نیس. کیفیت دوربین افتضاحه مخصوصا سلفی. باتری که ۲۴ ساعتم نگه نمیداره و داغ میکنه گوشی . گوشی قبلیم شیائومی نوت۱۱ پروپلاس بود سگش به این گوشی شرف داشت. متاسفم با خرید این گوشی فقط پولمو دور ریختم.,Yes,Yes,Yes,Yes,No
"باطری ضعیف ، اسپیکر ضعیف ، حرارت بالای گوشی ، ضمنا برای دوستانی که میخواهند A54 بخرند باید بدونند که اصلا گوشی خوش دست نیست ، A5Yes خیلی بهتر از این گوشی بود",Yes,No,Yes,Yes,No
"درسته از اخرین بروزرسانی که طی ده روز گذشته داشت مقداری مشکل داغ کردنش کمتر شده ولی مصرف باتریش رفته بالا.
معلوم نیست سامسونگ میخواد با این کاراش چه بلایی سر مصرف کننده ها و مشتریاش بیاره والا. هر روز داریم از یه مسئله ای از بابت گوشی اذیت میشیم . چرا باید با این همه پیشرفت گوشی سال ۲۰۲۳ ایراد هایی داشته باشه که گوشیه سال ۲۰۱۹ سامسونگ هیچ کدومو نداشت. A5Yes داشتم خدایش واسه زمتن خودش حتی در مقایسه با یه سری ایراد هایa54 عملکرد بهتری داشت",Yes,No,Yes,Yes,No
