1,Quality,Performance,Design,Price,Ease of use
مامانم خیلی وقته داره و واااقعا عالیه منم از دیجی خریدم ظاهرا که خیلی خوبه و کارکردن باهاش خیلی راحت و دوستداشتنی به نظرم جزو کالاهایی هست که حتما باید ایرانیشو خرید و پول الکی بابت خارجی ندید. من مدل های خارجیشو توی شوش دیدم و اصلا نپسندیدم. راستی روی درش یه قسمت کوچک دو میل فرو رفتگی داره که ضرب خوردگی نیست و جزو طراحیشه,Yes,Yes,Yes,Yes,Yes
من این زودپز رو نزدیک ۱۳ ساله دارم و کاملا ازش راضیم. این سری هم برای مامانم خریدم. نسبت به قیمت و کیفیت به نظرم بهتر از بقیه زودپزاست.,Yes,No,No,Yes,No
درب آن ضربه داشت و فاقد واشر من نفر دهم چندم که این محصول خراب براش ارسال میشه,Yes,No,No,No,No
"من دو بار این جنس را سفارش دادم ، بار اول بخاطر ضربه کوچکی که روی درش بود مرجوع کردم ، بعد دو سه ماه دوباره سفارش دادم ، همان مورد را دوباره فرستادند !!! گویا چند نفر هم همین نظر را داشتند تا اینکه بالاخره در تصویر اشاره شد که اون خط برای تنظیم در طراحی شده ولی کاش شکل فلش داشت تا سو تفاهم نشه !! دو بار استفاده کردم ، درش لکه برداشته ، پاک نمیشه ، در نظرات قبلی این مورد را ندیدم ، لابد مثل همه اجناس ایرانی ، از کیفیتش زده اند!! بهرحال زودپزی اش خیلی خوبه عملکردش هم عالی ",Yes,Yes,Yes,No,Yes
من الان حدود 22 ساله دارم از این زود پز استفاده میکنم عالی بوده فقط چند سال یکبار لاستیک دور درش و عوض میکنم,Yes,Yes,No,No,No
ضربه خورده بود با اینکه یکی دیگه هم همینو گرفته بود مرجوع کرد بازم برای من ارسال کردن,No,No,No,No,No
من یکی عین همین تو داشتم الان ۲۰ ساله که خوب خوب کار می کنه . واقعا یک وسیله خوب برای آشپزخونه است .,Yes,Yes,No,No,No
خیلی خوب و عالی اول میخواستم هزینه بیشتر کنم و خارجی بخرم ولی الان خیلی راضی هستیم فوق العاده شیک و راحت البته فقط صدای صوت داره که به نظرم طبیعی و به اندازست,Yes,No,Yes,Yes,Yes
سلام دوستان من این محصول رو از دیجی خریدم از همه جا ارزون تره زدن از مغازه پرسیدم ۱۶۰۰ گفتن اگه این سایتا نباشه این مغازه ها مردم رو سر کیسه میکنن,No,No,No,Yes,No
این زودپز وافعا عالیه.من یک زودپز مارک بیم دارم ولی فقط بااین محصول کار میکنم.ممنون از شرکت تولیدکننده اش که همچنان کیفیتش را حفظ کرده,Yes,No,No,No,No
"من ۱۴ ساله دارمش و حداقل هفته ای دوبار استفاده شده،گاهی هم بیشتر........هنوز خدا رو شکر مثل روز اول ظاهر تمیز و براق و کارایی کامل داره.....بی نظیره!",Yes,Yes,Yes,No,No
"خیلی جالبه ، عکس بنده رو با دیگر عکسی که سال ۹۹ ارسال شده چک بفرمایید ، جنس مرجوعی اون دوست عزیز رو برای من فرستادند البته در این بین شاید برای ده ها نفر دیگه هم رفته باشه و مرجوع کرده باشند ! آخه چرا ؟؟؟ البته که جنسی که برای من ارسال شد لاستیک درب هم نداشت و مرجوع کنم حالا خدا میدونه دوباره دست کدوم بنده خدایی میره …",Yes,No,No,No,No
"من همین الان به دستم رسید، بسته بندی مرتب بود ک مشکلی نداشت، ظاهر خوبی هم داره",Yes,No,Yes,No,No
من چندین سال این دیگ زودپز رو دارم و ازش راضیم و حالا هم برای جهاز دخترم خریدم,Yes,No,No,No,No
من یه ساله دارم استفاده میکنم واقعا راضی ام اصلا آب کم نمیکنه و خیلی پر کاربرد,Yes,Yes,No,No,No
"من حدود بیست ساله دارمش،بر جهازم گرفتم.عالیه.ماشالله هیچ ایرادی نداره.ایمن و راحت فقط وقتی گازو خاموش میکنید بزارید بخارش خودش به مرور خارج بشه، سوتک خروج بخار رو فشار ندید ، یا زیر آب نگیرید که خطرناکه",Yes,Yes,No,No,Yes
زود پز پارس استیل طراحی ساده و خوبی داره با صدای کم کار می کنه آب کم نمیکنه و بو و طعم غدا تغببری نمکبنه ولی با توجه به توضیحاتی که قبل از خرید مطالعه کرده بودم داخل زود پز قسمت کف آن پس از پخت اول و بعد از شتشو لک برداشته و از بین نرفت ,Yes,Yes,Yes,No,Yes
بسته بندی عالی و عینا شبیه عکس. ۶ لیتری بزرگه و برای خانواده های پرجمعیت خوبه. ۴ لیتری کوتاهتر و البته مناسب خانواده و حجم کم غذا ... چفت شدن در و دسته ها خوب بودن,Yes,No,Yes,No,No
خوب و عالی من راضی هستم در صورت بروز مشکل میدونم همیشه لوازم جانبیش تو ایران هست با قبمت مناسب,Yes,No,No,Yes,No
بعداز شست‌وشو کف زودپز لکه های سیاه میمونه توی دفترچه راهنما نوشته از بین میره امیدوارم که بره,Yes,No,No,No,No
دفعات اول خیلی خوب و بی صدا و اصلا آب کم نمیکرد ولی از دفعات سوم و چهارم به بعد بخار و قطره های آب به بیرون نفوذ میکرد ...نسبت به قیمت نمیارزه بهتره پول بیشتری بدید و جنس خارجی با کیفیت بگیرید,Yes,Yes,No,Yes,No
"من اینوخریدم اول دودل بودم اینو بخرم یا کرکماز،ولی الان نظرم برگشت وواقعا جنسش عالیه من چندین بارباهاش غذادرست کردم حتی زوتر ازاون زمان خودش اماده میشه حتی قلمه گذاشتم بپزه تمام سرقلمهارو نرم کرده بودازلحاظ ایمنی هم خیالتون راحت سوپاپ طوری طراحی شده که بخارت اضافه روخارج میکنه نه همه بخارو مثل قدیمیها نیست جنس استیلش هم عالیه برابازکردنش هم کافیه صبر کنید تاسوپاپ به حالت اولیه برگردد،حتما ارزش خرید داره بخاطرطراحی خوب سوپاپ نگران بی اب شدن غذانباشید ",Yes,Yes,Yes,Yes,Yes
"من این کار رو با اکانت دوستم خریدم واقعا حرف نداره سرعت پخت عالی، قیمت مناسب، کاملا بی صدا، با حرارت خیلی خیلی پایین باید بزارید رو گاز که تو دفترچه اش توضیح داده که خودش مزیتی هست برای مصرف کم انرژی، اصلا هم بوی غذا نمیگیره، خودش هم بوی بد نداره، در یک کلام کم نظیر و فوق العاده",Yes,Yes,No,Yes,No
زودپز پارس استیل تا الان چند سری ازش استفاده کردم خیلی کم صدا هست زود هم میپزه بدون عیب و نقص گارانتی هم اگه فروشنده دیجیکالا باشه از زمان فاکتور خرید محاسبه می شود,Yes,Yes,No,No,No
باکمال تعجب برای بار دوم کارتونی که برام زودپزو ارسال کرده بودن از دوطرف باز شده بود دفعه قبل هم خرید کردم از دیجی کالا بازهم کارتونش مخدوش وپاره بود,Yes,No,No,No,No
